{
  "schema_version": 1,
  "id": "synthetic-empty",
  "language": "en",
  "kind": "manual_cues",
  "timebase": "seconds",
  "media_duration_s": 32.0,
  "offset_s": 0,
  "provenance": {
    "created_by": "scripts/calib_alignment.py synthetic fixture",
    "tool_version": "hand-written",
    "annotators": 0
  },
  "segments": [
    {
      "id": "r001",
      "text": "The lighthouse keeper never sleeps before the storm arrives",
      "start": 1.0,
      "end": 4.0,
      "utterance_id": "u001",
      "excluded": true,
      "exclude_reason": "spn"
    },
    {
      "id": "r002",
      "text": "He counts the waves and writes the number in a leather book",
      "start": 4.5,
      "end": 8.0,
      "utterance_id": "u002",
      "excluded": true,
      "exclude_reason": "spn"
    },
    {
      "id": "r003",
      "text": "Nobody in the village has ever asked to read that book",
      "start": 8.5,
      "end": 11.5,
      "utterance_id": "u003",
      "excluded": true,
      "exclude_reason": "spn"
    },
    {
      "id": "r004",
      "text": "Last winter the lamp failed for the first time in forty years",
      "start": 12.0,
      "end": 15.5,
      "utterance_id": "u004",
      "excluded": true,
      "exclude_reason": "spn"
    }
  ]
}
